event_id,date,axis,subtype,title,description,source_url,source_type,notes
E001,1986-11-06,immigration_usmx,legislation,IRCA — Immigration Reform and Control Act,Reagan signs IRCA granting amnesty to ~3 million undocumented immigrants and imposing employer sanctions,https://www.uscis.gov/tools/glossary/irca,government_agency,First major amnesty — major theme in Tigres del Norte corridos
E002,1988-07-06,elections_mx,presidential_election,Mexican Presidential Election 1988,PRI's Carlos Salinas de Gortari declared winner amid widespread fraud claims; Cuauhtémoc Cárdenas claims victory,https://doi.org/10.1017/S0022216X00010483,academic_journal,Formative political crisis; 'fraude electoral' trope enters popular culture
E003,1989-04-08,drug_war_mx,arrest,Arrest of Miguel Ángel Félix Gallardo,'El Padrino' — founder of Guadalajara Cartel arrested; leads to fragmentation into Sinaloa/Tijuana/Juárez cartels,https://www.dea.gov/galleries/drug-traffickers/miguel-ngel-flix-gallardo,government_agency,Watershed moment in cartel history; directly referenced in corridos
E004,1989-01-20,us_presidency,inauguration,George H.W. Bush inaugurated as 41st President,41st US President inaugurated; continues Reagan-era drug war and immigration policies,https://www.whitehouse.gov/about-the-white-house/presidents/george-h-w-bush/,government_archive,
E005,1991-01-01,us_presidency,inauguration_term,George H.W. Bush — Drug War escalation,Bush administration increases DEA budget and border enforcement; signs 1990 Crime Control Act,https://www.govinfo.gov/content/pkg/STATUTE-104/pdf/STATUTE-104-Pg4789.pdf,government_archive,
E006,1993-01-20,us_presidency,inauguration,Bill Clinton inaugurated as 42nd President,42nd US President inaugurated; NAFTA ratification and expanded border enforcement follow,https://www.whitehouse.gov/about-the-white-house/presidents/william-j-clinton/,government_archive,
E007,1993-11-17,immigration_usmx,policy,NAFTA approved by US Congress,House passes NAFTA; takes effect Jan 1 1994. Displaces Mexican agricultural workers → surge in migration,https://ustr.gov/trade-agreements/free-trade-agreements/north-american-free-trade-agreement-nafta,government_agency,Economic shock cited as migration driver in literature and corridos
E008,1994-01-01,immigration_usmx,treaty,NAFTA enters into force,North American Free Trade Agreement effective; eliminates tariffs; devastates Mexican smallholder agriculture,https://ustr.gov/trade-agreements/free-trade-agreements/north-american-free-trade-agreement-nafta,government_agency,
E009,1994-01-01,elections_mx,uprising,EZLN Zapatista uprising in Chiapas,Indigenous Zapatista Army rises against NAFTA and neoliberalism; 12 days of fighting; ongoing political insurgency,https://www.sipaz.org/en/,ngo,Coincides with NAFTA — twin symbolic events of 1994
E010,1994-08-22,elections_mx,presidential_election,Mexican Presidential Election 1994,Ernesto Zedillo (PRI) elected; Colosio previously assassinated. PRI dominance continues despite pressure,https://www.ine.mx/voto-y-elecciones/elecciones-historicas/,government_agency,
E011,1994-10-01,immigration_usmx,enforcement,Operation Gatekeeper launched in San Diego,INS launches massive border enforcement in San Diego sector — pushes crossings into deadly Sonoran desert,https://www.dhs.gov/xlibrary/assets/statistics/publications/ois_ill_pe_2006.pdf,government_agency,Directly increases migrant deaths; major corrido theme
E012,1994-11-08,immigration_usmx,ballot,California Proposition 187 passes,Voters approve measure barring undocumented immigrants from public services; later ruled unconstitutional,https://digitalcommons.law.ggu.edu/cgi/viewcontent.cgi?article=1619&context=ggulrev,academic_journal,Galvanized Latino political identity; echoed in Tigres lyrics
E013,1996-01-01,drug_war_mx,cartel,Amado Carrillo Fuentes at peak of power,"'El Señor de los Cielos' controls Juárez Cartel at height of power, largest cocaine transporter in Mexico",https://www.pbs.org/wgbh/pages/frontline/shows/mexico/,journalism,Subject of famous narcocorrido; Los Tucanes connection
E014,1997-07-01,drug_war_mx,arrest,Hector Palma Salazar arrested,'El Güero Palma' of Sinaloa Cartel arrested; Chapo Guzmán becomes dominant,https://www.dea.gov/,government_agency,
E015,1997-07-04,drug_war_mx,death,Death of Amado Carrillo Fuentes,El Señor de los Cielos dies during plastic surgery; significant shift in Juárez Cartel power,https://www.nytimes.com/1997/07/04/world/mexican-drug-lord-dies-after-surgery.html,journalism,Multiple corridos written about his death
E016,2000-07-02,elections_mx,presidential_election,Mexican Presidential Election 2000 — PAN wins,Vicente Fox (PAN) defeats PRI ending 71-year single-party rule; historic democratic transition,https://www.ine.mx/voto-y-elecciones/elecciones-historicas/,government_agency,Massive cultural moment — end of PRI era reflected in lyrics
E017,2001-01-20,us_presidency,inauguration,George W. Bush inaugurated as 43rd President,43rd US President inaugurated; post-9/11 border securitization dramatically reshapes immigration enforcement,https://www.whitehouse.gov/about-the-white-house/presidents/george-w-bush/,government_archive,
E018,2001-01-19,drug_war_mx,arrest,First capture of Joaquín 'El Chapo' Guzmán,El Chapo arrested at Puente Grande prison; escapes in 2001 in laundry cart,https://www.dea.gov/galleries/drug-traffickers/joaqu-n-archivaldo-guzm-n-loera,government_agency,
E019,2001-06-19,drug_war_mx,escape,El Chapo escapes from Puente Grande prison,Guzmán escapes maximum security prison; becomes most wanted fugitive in Mexico,https://www.dea.gov/galleries/drug-traffickers/joaqu-n-archivaldo-guzm-n-loera,government_agency,Fodder for numerous narcocorridos
E020,2006-01-01,immigration_usmx,enforcement,Secure Fence Act — signed December 2005,Congress authorizes 700 miles of border fence; construction accelerates 2006-2009,https://www.govinfo.gov/content/pkg/PLAW-109publ367/pdf/PLAW-109publ367.pdf,government_archive,
E021,2006-04-09,immigration_usmx,protest,Great American Boycott — immigration marches,Millions march across US cities on May 1 against HR 4437 (criminalization of undocumented immigrants); largest immigrant mobilization in US history,https://www.latimes.com/archives/la-xpm-2006-may-02-na-march2-story.html,journalism,Los Tigres del Norte performed at rallies
E022,2006-07-02,elections_mx,presidential_election,Mexican Presidential Election 2006 — Calderón vs AMLO,Felipe Calderón (PAN) narrowly defeats Andrés Manuel López Obrador amid fraud controversy; AMLO refuses to concede,https://www.ine.mx/voto-y-elecciones/elecciones-historicas/,government_agency,Deeply polarizing; left vs right narrative in corridos
E023,2006-12-11,drug_war_mx,policy,Calderón launches War on Drugs,"Felipe Calderón deploys 6,500 troops to Michoacán; beginning of 6-year militarized drug war",https://www.wilsoncenter.org/article/mexicos-drug-war,research_institute,Turning point — narco violence explodes; defines entire era of corridos
E024,2007-01-01,drug_war_mx,policy,Plan Mérida Initiative negotiations begin,US-Mexico security cooperation framework; $1.4 billion aid package for drug war,https://www.state.gov/the-merida-initiative/,government_agency,
E025,2008-10-22,drug_war_mx,policy,Mérida Initiative signed into law,Bush signs $400M first installment of Mérida Initiative security cooperation,https://www.state.gov/the-merida-initiative/,government_agency,
E026,2009-01-20,us_presidency,inauguration,Barack Obama inaugurated as 44th President,44th US President inaugurated; later signs DACA (2012) and enacts record deportations 2009-2016,https://www.whitehouse.gov/about-the-white-house/presidents/barack-obama/,government_archive,
E027,2009-03-01,drug_war_mx,violence,Peak cartel violence in Ciudad Juárez,"Juárez becomes murder capital of world; 2,600+ homicides in 2009 alone; civilian massacre at Villas de Salvarcar",https://www.conapo.gob.mx/,government_agency,
E028,2010-02-18,drug_war_mx,massacre,Villas de Salvarcar massacre,Gunmen kill 16 teenagers at a student party in Juárez; Calderón initially dismisses victims as gang members,https://www.bbc.co.uk/news/world-latin-america-10799501,journalism,
E029,2010-01-01,drug_war_mx,cartel,Los Zetas formal split from Gulf Cartel,Los Zetas break from Gulf Cartel; massive territorial war begins across northeast Mexico,https://www.insightcrime.org/mexico-organized-crime-news/zetas-profile/,research_institute,Major narrative shift in narcocorridos — Zetas become primary villain figure
E030,2011-03-03,drug_war_mx,massacre,San Fernando massacre — 193 migrants killed,Zetas massacre 193 Central American migrants at San Fernando Tamaulipas; worst mass killing of migrants,https://www.ohchr.org/en/press-releases/2011/03/mexico-un-experts-call-independent-investigation-san-fernando-massacre,international_org,Intersection of migration and narco themes
E031,2012-06-15,immigration_usmx,executive_order,DACA announced by Obama,"Deferred Action for Childhood Arrivals — protection for ~800,000 DREAMers; no deportation + work permits",https://www.uscis.gov/DACA,government_agency,Major policy moment; generational shift in immigration debate
E032,2012-07-01,elections_mx,presidential_election,Mexican Presidential Election 2012 — PRI returns,Enrique Peña Nieto (PRI) wins; PRI returns to power after 12-year PAN interlude,https://www.ine.mx/voto-y-elecciones/elecciones-historicas/,government_agency,
E033,2013-02-22,drug_war_mx,arrest,Arrest of Mario Cárdenas Guillén (Gulf Cartel),Senior Gulf Cartel figure arrested; continues fragmentation of Gulf organization,https://www.dea.gov/,government_agency,
E034,2014-02-22,drug_war_mx,arrest,First re-arrest of El Chapo Guzmán,Captured at Mazatlán hotel; federal forces coordinated operation,https://www.dea.gov/galleries/drug-traffickers/joaqu-n-archivaldo-guzm-n-loera,government_agency,Major narcocorrido event
E035,2014-09-26,drug_war_mx,massacre,Ayotzinapa — 43 students disappeared,43 normalista students from Ayotzinapa Rural Teachers College disappear in Iguala Guerrero; state complicity alleged,https://www.gob.mx/comisionparalaverdad,government_agency,Defining atrocity of Peña Nieto era; massive cultural/lyrical response
E036,2015-07-11,drug_war_mx,escape,El Chapo second prison escape,Escapes through 1.5km tunnel from Altiplano prison; largest manhunt in Mexico,https://www.dea.gov/galleries/drug-traffickers/joaqu-n-archivaldo-guzm-n-loera,government_agency,
E037,2016-01-08,drug_war_mx,arrest,El Chapo final recapture,Captured in Los Mochis following Sean Penn Rolling Stone interview; later extradited to US,https://www.dea.gov/galleries/drug-traffickers/joaqu-n-archivaldo-guzm-n-loera,government_agency,
E038,2017-01-20,us_presidency,inauguration,Donald Trump inaugurated as 45th President,Campaign centered on border wall and mass deportation; immediate immigration executive orders,https://www.whitehouse.gov/about-the-white-house/presidents/donald-j-trump/,government_archive,
E039,2017-01-25,immigration_usmx,executive_order,Trump border wall executive order,"Executive Order 13767 — directs construction of border wall, increased deportations, end of catch-and-release",https://www.federalregister.gov/documents/2017/01/30/2017-02095/border-security-and-immigration-enforcement-improvements,government_archive,
E040,2017-01-27,immigration_usmx,executive_order,Trump travel ban (Executive Order 13769),Bans nationals from 7 Muslim-majority countries; signals restrictionist turn; massive protests,https://www.federalregister.gov/documents/2017/02/01/2017-02281/protecting-the-nation-from-foreign-terrorist-entry-into-the-united-states,government_archive,
E041,2017-09-05,immigration_usmx,executive_order,DACA rescinded by Trump administration,"Sessions announces end of DACA program; ~700,000 recipients face deportation threat",https://www.dhs.gov/news/2017/09/05/memorandum-rescission-daca,government_agency,
E042,2018-04-06,immigration_usmx,policy,Zero Tolerance policy announced,Sessions announces 100% criminal prosecution of illegal border crossers; leads to family separations,https://www.justice.gov/opa/pr/attorney-general-announces-zero-tolerance-policy-criminal-illegal-entry,government_agency,
E043,2018-06-20,immigration_usmx,executive_order,Trump ends family separation policy,"Executive Order signed after global outcry; 2,700+ children already separated from parents",https://www.federalregister.gov/documents/2018/06/25/2018-13696/affording-congress-an-opportunity-to-address-family-separation,government_archive,
E044,2018-07-01,elections_mx,presidential_election,Mexican Presidential Election 2018 — AMLO wins,Andrés Manuel López Obrador (MORENA) wins with 53%; first left-wing president in modern era,https://www.ine.mx/voto-y-elecciones/elecciones-historicas/,government_agency,Historic shift; Cuarta Transformación rhetoric
E045,2019-01-17,drug_war_mx,event,Culiacanazo — El Chapo's son released,Mexican security forces capture Ovidio Guzmán but release him after Sinaloa cartel paralyzes Culiacán with gunmen; humiliation for AMLO government,https://www.bbc.com/news/world-latin-america-50070871,journalism,Major narco-political event; widely discussed
E046,2019-01-25,immigration_usmx,policy,MPP / Remain in Mexico policy begins,Migrant Protection Protocols force asylum seekers to wait in Mexico; creates tent cities at border,https://www.dhs.gov/news/2019/01/24/migrant-protection-protocols,government_agency,
E047,2019-08-04,drug_war_mx,trial,El Chapo sentenced to life in US prison,Convicted on all 10 counts by Brooklyn federal jury; sentenced to life + 30 years,https://www.justice.gov/opa/pr/joaquin-el-chapo-guzman-sinaloa-drug-lord-sentenced-life-prison-plus-thirty-years,government_agency,
E048,2020-11-03,us_presidency,presidential_election,Biden elected — defeats Trump,Joe Biden wins 2020 presidential election; reverses many Trump immigration policies,https://www.fec.gov/introduction-campaign-finance/election-results-and-voting-information/,government_agency,
E049,2021-01-20,us_presidency,inauguration,Joe Biden inaugurated as 46th President,Reverses Trump travel bans; reinstates DACA; new asylum policies,https://www.whitehouse.gov/about-the-white-house/presidents/joseph-r-biden/,government_archive,
E050,2022-01-01,drug_war_mx,cartel,CJNG consolidates dominance,Cartel Jalisco Nueva Generación under Nemesio Oseguera ('El Mencho') becomes most powerful cartel nationally,https://www.insightcrime.org/mexico-organized-crime-news/jalisco-cartel-new-generation-cjng-profile/,research_institute,
E051,2023-03-07,drug_war_mx,event,Sinaloa Cartel factions fracture — Chapitos vs Mayos,Internal Sinaloa conflict between sons of El Chapo (Chapitos) and faction of El Mayo (Zambada),https://www.insightcrime.org/news/sinaloa-fractures-bloody-war-chapitos-mayos/,research_institute,
E052,2024-10-15,elections_mx,presidential_election,Claudia Sheinbaum elected President of Mexico,First woman president in Mexican history; MORENA continues; takes office Oct 1 2024,https://www.ine.mx/,government_agency,
E053,2025-01-20,us_presidency,inauguration,Donald Trump inaugurated as 47th President (2nd term),Declares national emergency at border; designates cartels as terrorist organizations; mass deportation operations,https://www.federalregister.gov/presidential-documents/executive-orders/donald-trump/2025,government_archive,
E054,2025-03-15,immigration_usmx,executive_order,Alien Enemies Act invoked for deportations,Trump invokes 1798 Alien Enemies Act to expedite deportation of alleged Tren de Aragua/cartel members,https://www.federalregister.gov/,government_archive,
E055,1985-02-07,drug_war_mx,murder,Camarena murder — DEA agent killed,DEA Agent Enrique Camarena kidnapped and murdered by Guadalajara Cartel; led to Operation Leyenda and US-Mexico drug war cooperation,https://www.dea.gov/stories/2020/2020-09/2020-09-30/remembering-kiki-camarena,government_agency,Pivotal event; accelerated cartel crackdowns
E056,1990-01-01,us_presidency,inauguration_term,George H.W. Bush — Drug War escalation,Bush administration intensifies domestic war on drugs; increases DEA and border enforcement budgets,https://www.ojp.gov/ncjrs/virtual-library/abstracts/national-drug-control-strategy-1990,government_agency,
E057,1995-01-01,immigration_usmx,enforcement,Operation Hold the Line — El Paso,Border Patrol strategy of 'prevention through deterrence' in El Paso sector deployed nationally,https://www.borderpatrolmuseum.com/,institutional,
E058,2003-01-01,drug_war_mx,cartel,Gulf Cartel hires Zetas as armed wing,Former elite Mexican soldiers (GAFE) form Los Zetas as enforcement arm of Gulf Cartel under Osiel Cárdenas,https://www.insightcrime.org/mexico-organized-crime-news/zetas-profile/,research_institute,
E059,2008-01-01,drug_war_mx,violence,Juárez Cartel vs Sinaloa war begins,"Bloodiest cartel conflict in Mexican history begins in Ciudad Juárez; 10,000+ killed 2008-2012",https://www.wilsoncenter.org/,research_institute,
E060,2016-11-08,us_presidency,presidential_election,Trump elected President,Anti-immigration platform central to campaign; galvanizes both deportation fears and resistance,https://www.fec.gov/introduction-campaign-finance/election-results-and-voting-information/,government_agency,
E061,1981-01-20,us_presidency,inauguration,Ronald Reagan inaugurated as 40th President,Begins anti-communist foreign policy; drug war rhetoric; economic policies affecting Mexican labor migration,https://www.whitehouse.gov/about-the-white-house/presidents/ronald-reagan/,government_archive,
E062,2001-09-11,immigration_usmx,security,9/11 attacks — border security tightens,Terrorist attacks lead to massive border securitization; INS reorganized into DHS; immigration enforcement hardened,https://www.dhs.gov/history,government_agency,
E063,1994-12-01,elections_mx,economic_crisis,Mexican Peso Crisis (Tequila Crisis),Peso devaluation triggers economic crisis; unemployment surges; migration to US increases dramatically,https://www.banxico.org.mx/,government_agency,Strong economic driver for migration themes
E064,2006-06-19,immigration_usmx,protest,Great American Boycott — May Day marches,"500,000+ march in Los Angeles; Tigres del Norte performed; ""Un Día sin Inmigrantes"" movement",https://www.latimes.com/archives/la-xpm-2006-may-02-na-march2-story.html,journalism,Los Tigres del Norte politically engaged moment
E065,2011-01-01,drug_war_mx,cartel,Caballeros Templarios founded in Michoacán,Knights Templar Cartel emerges from ashes of La Familia Michoacana; quasi-religious narco structure,https://www.insightcrime.org/mexico-organized-crime-news/knights-templar-profile/,research_institute,
